{
  "schema": "genre-template/v1",
  "template_id": "urban-revenge-realist-v1",
  "display_name": "都市复仇·现实向",
  "genre": "revenge",
  "status": "draft",
  "promoted_by_eval_run": null,
  "differentiation_axis": "复仇的伦理代价，而非爽点密度。逆袭是最大盘（关联 48917 部、播放 7389 亿，为第二名 5 倍以上），但爽文类占 80% 以上市场且价值观单一，爆款率不足 0.1%。在爽点上正面竞争胜算低；本模板改为竞争「正当的诉求带着无法回避的代价」，这正是 human_credibility 与 originality 两个关键维度能兑现的地方。",
  "market_note": "逆袭为抖音端原生关联剧数第一、投流侧热力值 19%。红果 8-10 月重点激励品类中男频占 6 席，含复仇。",
  "constraints": {
    "episodes_range": [
      10,
      16
    ],
    "minutes_per_episode": 2,
    "max_locations": 5,
    "max_speaking_cast": 8,
    "production_level": "low_budget",
    "audience": "25-45"
  },
  "forbidden_elements": [
    "当众揭发一次解决",
    "加害者当场认罪",
    "匿名举报一次翻盘",
    "意外身亡替代清算",
    "加害者破产潦倒作为结局"
  ],
  "required_conditions": [
    "主角的复仇行动至少一次伤及无辜或伤及自身",
    "加害者具备可理解的动机，不是纯粹的恶",
    "结局不依赖外部权威（法律、上级、舆论）替主角完成清算"
  ],
  "skills": [],
  "retrieval_collections": [
    "licensed-story-patterns",
    "human-detail-notes"
  ],
  "rubric_overrides": null,
  "content_form": "scripted_short_drama",
  "content_form_note": "Level 2 template inside one content form. Knowledge/explainer and real-creator forms need their own artifact schema and rubric; see the content-form section in HANDOFF.md. Do not treat this file as a cross-form template."
}
